{"candidate":{"decision":{"id":"a001"},"decision_digest":"sha256:f214d26836e2823729ae76fb05282077c200dc94ac987ba4b79373c4b5370b1a","outcome":["21","80","87"]},"canonicalisation":"psp-json-c14n-1","claim":"nonnegative_weight_unsupported","format":"pareto-support-certificate","instance_digest":"sha256:132a251dce0383a659fdc1f44af0d0de311fbc6b3bbac82917402b3564cb7c00","integrity":{"algorithm":"sha256","canonicalisation":"psp-json-c14n-1","certificate_digest":"sha256:bba77fa505630ffb3b0be91a332e6739e40c75ef4c6c018620124c4f4e5c34ed"},"negative_payload":{"atoms":[{"coefficient":"1","decision":{"id":"a008"},"decision_digest":"sha256:78ea0b2c0be1c2a2840389579a0bff9206b3cc1ff8220052175ce4ce6b174f31","outcome":["6","10","22"]}],"coefficient_sum":"1","coordinate_sums":["-15","-70","-65"],"normalisation":"primitive-positive-integers-gcd-1","strict_margin":"15/1"},"problem_type":"explicit_image","provenance":{"algorithm":"exact-exchange-v1","context":{"case_id":"explicit_p3_s1009_hash_control","protocol_sha256":"356a26e2c79b1a6827d24e4236484ef1586c29dc835a59b4bfc202785478ff1a"},"deterministic":true,"exact_arithmetic":"fractions.Fraction","generator":{"name":"pareto-support-proofs","version":"0.6.1"},"oracle_adapter":"explicit_enumeration_exact_v1","trace_digest":"sha256:38cb61636dee0dab91d212bbda55d86a85952980e1c8fac341801117ed55a2f2"},"schema_version":"1.0.0","trust_level":"P1_FULLY_CHECKABLE"}
