{"candidate":{"decision":{"id":"a013"},"decision_digest":"sha256:e95dc62119205db55a2e8e5383efddf3b4d824efc493c01135c32d47f1934bf8","outcome":["58","18"]},"canonicalisation":"psp-json-c14n-1","claim":"nonnegative_weight_supportable","format":"pareto-support-certificate","instance_digest":"sha256:c88dff98ab23f80da9a011ae005fe4eaa5748ce83b215d5949fff9ae0e1223b0","integrity":{"algorithm":"sha256","canonicalisation":"psp-json-c14n-1","certificate_digest":"sha256:9a51f0eb41a387cf9c75fc64e6b63861e8ac0eaf462af4ae62da1d07ff2eddf5"},"positive_payload":{"candidate_scalar_value":"18/1","oracle":{"adapter":"explicit_enumeration_exact_v1","proof":{"minimiser_decision":{"id":"a013"},"minimiser_outcome":["58","18"],"minimum_value":"18/1","tie_break":"canonical-decision-order"},"proof_type":"explicit_enumeration_v1"},"scalar_minimum":"18/1","weight_floor":"0/1","weights":["0/1","1/1"]},"problem_type":"explicit_image","provenance":{"algorithm":"exact-exchange-v1","context":{"case_id":"explicit_p2_s1007_epsilon_q42","protocol_sha256":"356a26e2c79b1a6827d24e4236484ef1586c29dc835a59b4bfc202785478ff1a"},"deterministic":true,"exact_arithmetic":"fractions.Fraction","generator":{"name":"pareto-support-proofs","version":"0.6.1"},"oracle_adapter":"explicit_enumeration_exact_v1","trace_digest":"sha256:2323bac743c9a5213b14ea54b6bc93a6c37a1383af0e71ed79a331cb9cdbf418"},"schema_version":"1.0.0","trust_level":"P1_FULLY_CHECKABLE"}
