{"candidate":{"decision":{"edge_ids":["r0_e0001","r0_e0002","r0_e0003","r0_e0004","r0_e0005","r0_e0006","r0_e0007","r0_e0008","r0_e0009","r0_e0010","r0_e0011","r0_e0012","r0_e0013","r0_e0014","r0_e0015","r0_e0016","r0_e0017","r0_e0018","r0_e0019","r0_e0020"]},"decision_digest":"sha256:7ef0018e1c854220a82b5b31adff1459d1b0f218a31facef675089fdab050c77","outcome":["26","26"]},"canonicalisation":"psp-json-c14n-1","claim":"nonnegative_weight_unsupported","format":"pareto-support-certificate","instance_digest":"sha256:6986f673e52f39c4d4d685e7c3195b8f030b02cc56b16ccdb69fc91f8cdca815","integrity":{"algorithm":"sha256","canonicalisation":"psp-json-c14n-1","certificate_digest":"sha256:3d4f249a8cb678bc7c1f36b9d4ffa89e026f81c9222c9f6a0ed3e8e3306aefea"},"negative_payload":{"atoms":[{"coefficient":"1","decision":{"edge_ids":["r1_e0001","r1_e0002","r1_e0003","r1_e0004","r1_e0005","r1_e0006","r1_e0007","r1_e0008","r1_e0009","r1_e0010","r1_e0011","r1_e0012","r1_e0013","r1_e0014","r1_e0015","r1_e0016","r1_e0017","r1_e0018","r1_e0019","r1_e0020"]},"decision_digest":"sha256:522a4e1aae066f050b75c80ba41891867e09f18539e123ce6840445394dad9e9","outcome":["24","27"]},{"coefficient":"1","decision":{"edge_ids":["r2_e0001","r2_e0002","r2_e0003","r2_e0004","r2_e0005","r2_e0006","r2_e0007","r2_e0008","r2_e0009","r2_e0010","r2_e0011","r2_e0012","r2_e0013","r2_e0014","r2_e0015","r2_e0016","r2_e0017","r2_e0018","r2_e0019","r2_e0020"]},"decision_digest":"sha256:cf1cfd675b9a257334110f8750ff2b34ad85756207c1416fcd0a297639a083ca","outcome":["27","24"]}],"coefficient_sum":"2","coordinate_sums":["-1","-1"],"normalisation":"primitive-positive-integers-gcd-1","strict_margin":"1/2"},"problem_type":"shortest_path","provenance":{"algorithm":"exact-exchange-v1","context":{"case_id":"shortest_path_L20_p2_unsupported","protocol_sha256":"356a26e2c79b1a6827d24e4236484ef1586c29dc835a59b4bfc202785478ff1a"},"deterministic":true,"exact_arithmetic":"fractions.Fraction","generator":{"name":"pareto-support-proofs","version":"0.6.1"},"oracle_adapter":"shortest_path_exact_dijkstra_v1","trace_digest":"sha256:e046c7903507627012853c4a5b3bb8cf57937dd8c6cd91eb7d6ecc267cd25f43"},"schema_version":"1.0.0","trust_level":"P1_FULLY_CHECKABLE"}
