{"candidate":{"decision":{"edge_ids":["e0008","e0012"]},"decision_digest":"sha256:d330802f59cb7baf6143c501fbafb2957e3d52028c30996c05d028557a51f25b","outcome":["27","37","41","44"]},"canonicalisation":"psp-json-c14n-1","claim":"nonnegative_weight_supportable","format":"pareto-support-certificate","instance_digest":"sha256:f0c8056ae5dfbb0d7dc8fc482247a379478f5a7fe5c0f463dcf5c98ba482d0e6","integrity":{"algorithm":"sha256","canonicalisation":"psp-json-c14n-1","certificate_digest":"sha256:ce2bdca528360db1d4feae87a80d5134bb6add74cf9985a4864613c3096781f4"},"positive_payload":{"candidate_scalar_value":"27/1","oracle":{"adapter":"shortest_path_exact_dijkstra_v1","proof":{"constant_value":"0/1","minimiser_decision":{"edge_ids":["e0008","e0012"]},"minimiser_outcome":["27","37","41","44"],"minimum_value":"27/1","node_potentials":{"v0":"0/1","v1":"4/1","v2":"27/1","v3":"31/1","v4":"9/1","v5":"25/1","v6":"25/1","v7":"27/1"},"path_value":"27/1"},"proof_type":"shortest_path_potentials_v1"},"scalar_minimum":"27/1","weight_floor":"0/1","weights":["1/1","0/1","0/1","0/1"]},"problem_type":"shortest_path","provenance":{"algorithm":"exact-exchange-v1","context":{"case_id":"shortest_path_p4_s3004_epsilon_q42","protocol_sha256":"356a26e2c79b1a6827d24e4236484ef1586c29dc835a59b4bfc202785478ff1a"},"deterministic":true,"exact_arithmetic":"fractions.Fraction","generator":{"name":"pareto-support-proofs","version":"0.6.1"},"oracle_adapter":"shortest_path_exact_dijkstra_v1","trace_digest":"sha256:e9c3fb5b799e54a8e9f3014778a48696c43f845dda2a18997c9cd2c5ad62b44f"},"schema_version":"1.0.0","trust_level":"P1_FULLY_CHECKABLE"}
