{"candidate":{"decision":{"id":"a001"},"decision_digest":"sha256:f214d26836e2823729ae76fb05282077c200dc94ac987ba4b79373c4b5370b1a","outcome":["76","64","55"]},"canonicalisation":"psp-json-c14n-1","claim":"nonnegative_weight_unsupported","format":"pareto-support-certificate","instance_digest":"sha256:bd34586a157beb769384753cda519f8d14333bb2a3f883d4c8a3bf52222e4552","integrity":{"algorithm":"sha256","canonicalisation":"psp-json-c14n-1","certificate_digest":"sha256:85ac57aa3d211f4cf81c925bf8b5f1a45f6accd4b4819e9437d038e873d74fec"},"negative_payload":{"atoms":[{"coefficient":"1","decision":{"id":"a007"},"decision_digest":"sha256:75eaf302377eab957cc0e9183a7a00b252f7a01efd0c3e226d94852804a67464","outcome":["10","46","3"]}],"coefficient_sum":"1","coordinate_sums":["-66","-18","-52"],"normalisation":"primitive-positive-integers-gcd-1","strict_margin":"18/1"},"problem_type":"explicit_image","provenance":{"algorithm":"exact-exchange-v1","context":{"case_id":"explicit_p3_s1007_hash_control","protocol_sha256":"356a26e2c79b1a6827d24e4236484ef1586c29dc835a59b4bfc202785478ff1a"},"deterministic":true,"exact_arithmetic":"fractions.Fraction","generator":{"name":"pareto-support-proofs","version":"0.6.1"},"oracle_adapter":"explicit_enumeration_exact_v1","trace_digest":"sha256:9faf6c4f3329db0f5db796229d7290dc6b07952b80cbe4fdddf9411bddc4bee7"},"schema_version":"1.0.0","trust_level":"P1_FULLY_CHECKABLE"}
