{"candidate":{"decision":{"id":"a010"},"decision_digest":"sha256:3aa39ab6c8aac1225afeb5a417c2d38f89e0800b594741d3d3636b41ac127aa8","outcome":["59","28","110","18"]},"canonicalisation":"psp-json-c14n-1","claim":"nonnegative_weight_unsupported","format":"pareto-support-certificate","instance_digest":"sha256:02b2fbb270e9a288776bd1938bcb877c81b39cb96ad9e4c6dcd4573ecd954051","integrity":{"algorithm":"sha256","canonicalisation":"psp-json-c14n-1","certificate_digest":"sha256:facf4ed301400c787e14bfaf2fb170360e8c9614c18b29890c31a621b0c4edb4"},"negative_payload":{"atoms":[{"coefficient":"23","decision":{"id":"a003"},"decision_digest":"sha256:0122d9a9c37de6d2ff5d263c17429e32b0d33f590d1a80c8010d7369e736ee97","outcome":["116","12","84","39"]},{"coefficient":"37","decision":{"id":"a020"},"decision_digest":"sha256:c89d3c6be82147ccb7f331e0c3c5cc2d78a107785ec2f226445c73a261f83e51","outcome":["9","36","83","3"]}],"coefficient_sum":"60","coordinate_sums":["-539","-72","-1597","-72"],"normalisation":"primitive-positive-integers-gcd-1","strict_margin":"6/5"},"problem_type":"explicit_image","provenance":{"algorithm":"exact-exchange-v1","context":{"case_id":"explicit_p4_s1006_hash_control","protocol_sha256":"356a26e2c79b1a6827d24e4236484ef1586c29dc835a59b4bfc202785478ff1a"},"deterministic":true,"exact_arithmetic":"fractions.Fraction","generator":{"name":"pareto-support-proofs","version":"0.6.1"},"oracle_adapter":"explicit_enumeration_exact_v1","trace_digest":"sha256:9fe32f9f205e0d7f7d2c4e988e5f736e347a2da792e8c3795d004d43c74ce8ef"},"schema_version":"1.0.0","trust_level":"P1_FULLY_CHECKABLE"}
