{"candidate":{"decision":{"permutation":[2,3,0,1,4]},"decision_digest":"sha256:107e9fb2d78a12d49ed912ab8654f577cefb9fa6d3d4e7af3ceae9f0291e6b8a","outcome":["315","169","144","195"]},"canonicalisation":"psp-json-c14n-1","claim":"nonnegative_weight_supportable","format":"pareto-support-certificate","instance_digest":"sha256:2446bb0bd58437200928b8c6436616f1240690fbc44cd5970464d42b0c5e77f5","integrity":{"algorithm":"sha256","canonicalisation":"psp-json-c14n-1","certificate_digest":"sha256:d6985879600e0334494da016a23cb78222709aa1547debe9e5139c6021883fd8"},"positive_payload":{"candidate_scalar_value":"148608/887","oracle":{"adapter":"assignment_exact_hungarian_v1","proof":{"column_potentials":["-4349/887","0/1","-6445/887","-11529/887","-6849/887"],"constant_value":"-3139/887","matrix_value":"151747/887","minimiser_decision":{"permutation":[2,3,0,1,4]},"minimiser_outcome":["315","169","144","195"],"minimum_value":"148608/887","row_potentials":["36736/887","27993/887","42361/887","50315/887","23514/887"]},"proof_type":"assignment_primal_dual_v1"},"scalar_minimum":"148608/887","weight_floor":"0/1","weights":["0/1","162/887","395/887","330/887"]},"problem_type":"assignment","provenance":{"algorithm":"exact-exchange-v1","context":{"case_id":"assignment_p4_s2004_hash_control","protocol_sha256":"356a26e2c79b1a6827d24e4236484ef1586c29dc835a59b4bfc202785478ff1a"},"deterministic":true,"exact_arithmetic":"fractions.Fraction","generator":{"name":"pareto-support-proofs","version":"0.6.1"},"oracle_adapter":"assignment_exact_hungarian_v1","trace_digest":"sha256:33b91943d49a08a63da11e0c51a2af71b1e9256eda18e7ff2a4568262b8e59a7"},"schema_version":"1.0.0","trust_level":"P1_FULLY_CHECKABLE"}
