{"candidate":{"decision":{"edge_ids":["e0009"]},"decision_digest":"sha256:f4f02351584125b42f0dc16bdc104504743cb63501cc455f066789ee29357d25","outcome":["28","28","33","30"]},"canonicalisation":"psp-json-c14n-1","claim":"positive_weight_supportable","format":"pareto-support-certificate","instance_digest":"sha256:fd79f42f2c66d2725d6931b77fcbc477a7d567130823cc9675b14d497bbf2154","integrity":{"algorithm":"sha256","canonicalisation":"psp-json-c14n-1","certificate_digest":"sha256:34b2874215c4cf0ee0512d46b816a5416320cbc2dcfdc52328ab51f8abadfbc4"},"positive_payload":{"candidate_scalar_value":"119/4","oracle":{"adapter":"shortest_path_exact_dijkstra_v1","proof":{"constant_value":"0/1","minimiser_decision":{"edge_ids":["e0009"]},"minimiser_outcome":["28","28","33","30"],"minimum_value":"119/4","node_potentials":{"v0":"0/1","v1":"24/1","v2":"81/2","v3":"52/1","v4":"41/1","v5":"14/1","v6":"103/4","v7":"119/4"},"path_value":"119/4"},"proof_type":"shortest_path_potentials_v1"},"scalar_minimum":"119/4","weight_floor":"1/4","weights":["1/4","1/4","1/4","1/4"]},"problem_type":"shortest_path","provenance":{"algorithm":"exact-exchange-v1","context":{"case_id":"shortest_path_p4_s3001_epsilon_q42","protocol_sha256":"356a26e2c79b1a6827d24e4236484ef1586c29dc835a59b4bfc202785478ff1a"},"deterministic":true,"exact_arithmetic":"fractions.Fraction","generator":{"name":"pareto-support-proofs","version":"0.6.1"},"oracle_adapter":"shortest_path_exact_dijkstra_v1","trace_digest":"sha256:02b786c0bf429d12e54bb7427364b7decf6c9e048dbcb7043fb2839b69d86de1"},"schema_version":"1.0.0","trust_level":"P1_FULLY_CHECKABLE"}
