{"candidate":{"decision":{"id":"a016"},"decision_digest":"sha256:3155199b3a3164c75d03b708d92af62f28f7532148cf38e4c7e0b845581b7576","outcome":["98","33","11","14"]},"canonicalisation":"psp-json-c14n-1","claim":"positive_weight_supportable","format":"pareto-support-certificate","instance_digest":"sha256:adcb260d43cf1705b274469fa4c03e0be7442db29522275dbf0dc3446d6f160e","integrity":{"algorithm":"sha256","canonicalisation":"psp-json-c14n-1","certificate_digest":"sha256:79736c614c13a0ae86849b006d34f021c4086f73d3afab0dbcda37b26bcfb9e2"},"positive_payload":{"candidate_scalar_value":"39/1","oracle":{"adapter":"explicit_enumeration_exact_v1","proof":{"minimiser_decision":{"id":"a016"},"minimiser_outcome":["98","33","11","14"],"minimum_value":"39/1","tie_break":"canonical-decision-order"},"proof_type":"explicit_enumeration_v1"},"scalar_minimum":"39/1","weight_floor":"1/4","weights":["1/4","1/4","1/4","1/4"]},"problem_type":"explicit_image","provenance":{"algorithm":"exact-exchange-v1","context":{"case_id":"explicit_p4_s1008_epsilon_q42","protocol_sha256":"356a26e2c79b1a6827d24e4236484ef1586c29dc835a59b4bfc202785478ff1a"},"deterministic":true,"exact_arithmetic":"fractions.Fraction","generator":{"name":"pareto-support-proofs","version":"0.6.1"},"oracle_adapter":"explicit_enumeration_exact_v1","trace_digest":"sha256:ff061d38392ee3febfdd9390930ff0f3530277b2d5ed5c99db0752adc34c5d9b"},"schema_version":"1.0.0","trust_level":"P1_FULLY_CHECKABLE"}
