{"candidate":{"decision":{"permutation":[2,1,3,0,4]},"decision_digest":"sha256:70686862360748efcaba8b8e1d12c36a58d199b61674a19dccd4c94704dfc46d","outcome":["207","170"]},"canonicalisation":"psp-json-c14n-1","claim":"nonnegative_weight_unsupported","format":"pareto-support-certificate","instance_digest":"sha256:d80eda399360276a34cadce160562a75a3ee7a618671e80616391a034b38c6ae","integrity":{"algorithm":"sha256","canonicalisation":"psp-json-c14n-1","certificate_digest":"sha256:4bea073acce4ce923190406e6df741a5b15d06b05223e2519b43f837a4a1f26a"},"negative_payload":{"atoms":[{"coefficient":"1","decision":{"permutation":[0,3,1,2,4]},"decision_digest":"sha256:91926b5f4330ff29e8a0ce2cf8b324702593e5ffe59140434c0b0f5f2973ee57","outcome":["114","136"]}],"coefficient_sum":"1","coordinate_sums":["-93","-34"],"normalisation":"primitive-positive-integers-gcd-1","strict_margin":"34/1"},"problem_type":"assignment","provenance":{"algorithm":"exact-exchange-v1","context":{"case_id":"assignment_p2_s2001_hash_control","protocol_sha256":"356a26e2c79b1a6827d24e4236484ef1586c29dc835a59b4bfc202785478ff1a"},"deterministic":true,"exact_arithmetic":"fractions.Fraction","generator":{"name":"pareto-support-proofs","version":"0.6.1"},"oracle_adapter":"assignment_exact_hungarian_v1","trace_digest":"sha256:b9f5d49fea0ec1de4f6f6cc5c80669c308b2612cbdd819b42a292a9697f04c5f"},"schema_version":"1.0.0","trust_level":"P1_FULLY_CHECKABLE"}
