{"candidate":{"decision":{"id":"a003"},"decision_digest":"sha256:0122d9a9c37de6d2ff5d263c17429e32b0d33f590d1a80c8010d7369e736ee97","outcome":["34","15"]},"canonicalisation":"psp-json-c14n-1","claim":"nonnegative_weight_unsupported","format":"pareto-support-certificate","instance_digest":"sha256:381bebec9d66f41eee156a380805e393b7d6867556dafc840e089646a05905d1","integrity":{"algorithm":"sha256","canonicalisation":"psp-json-c14n-1","certificate_digest":"sha256:cad7ad1c512a9b13207e33649906972dad18e03d6d5a51ad380b79873aabf080"},"negative_payload":{"atoms":[{"coefficient":"29","decision":{"id":"a001"},"decision_digest":"sha256:f214d26836e2823729ae76fb05282077c200dc94ac987ba4b79373c4b5370b1a","outcome":["93","1"]},{"coefficient":"73","decision":{"id":"a021"},"decision_digest":"sha256:af5a9531236610036ba96f2a2462f094a9285028df729ff4e142713f81b3e85b","outcome":["10","20"]}],"coefficient_sum":"102","coordinate_sums":["-41","-41"],"normalisation":"primitive-positive-integers-gcd-1","strict_margin":"41/102"},"problem_type":"explicit_image","provenance":{"algorithm":"exact-exchange-v1","context":{"case_id":"explicit_p2_s1015_epsilon_q42","protocol_sha256":"356a26e2c79b1a6827d24e4236484ef1586c29dc835a59b4bfc202785478ff1a"},"deterministic":true,"exact_arithmetic":"fractions.Fraction","generator":{"name":"pareto-support-proofs","version":"0.6.1"},"oracle_adapter":"explicit_enumeration_exact_v1","trace_digest":"sha256:bef0a09ae401cd6fc3ad82bb658182e3c5d555b4a004a959dc6b01a9d72be8ba"},"schema_version":"1.0.0","trust_level":"P1_FULLY_CHECKABLE"}
