{"candidate":{"decision":{"edge_ids":["e0001","e0002","e0003","e0004","e0011"]},"decision_digest":"sha256:1760252b9f53f1cf248f76fe1034506d4abb8a5de071292bb723127933e75bbf","outcome":["78","110","68"]},"canonicalisation":"psp-json-c14n-1","claim":"nonnegative_weight_unsupported","format":"pareto-support-certificate","instance_digest":"sha256:2192c2d1cfd50791d292a9f652db2351d719d6f807e5a546724e98e6b7e4af51","integrity":{"algorithm":"sha256","canonicalisation":"psp-json-c14n-1","certificate_digest":"sha256:0612127221fa9bae551b39066617c17fbefabd3edf11632546769e88c03bbd75"},"negative_payload":{"atoms":[{"coefficient":"1","decision":{"edge_ids":["e0001","e0008"]},"decision_digest":"sha256:9c5d53b832732386e241609f54f8ddd5592bce15859da05bba2ae5e37266ddee","outcome":["22","53","35"]}],"coefficient_sum":"1","coordinate_sums":["-56","-57","-33"],"normalisation":"primitive-positive-integers-gcd-1","strict_margin":"33/1"},"problem_type":"shortest_path","provenance":{"algorithm":"exact-exchange-v1","context":{"case_id":"shortest_path_p3_s3005_hash_control","protocol_sha256":"356a26e2c79b1a6827d24e4236484ef1586c29dc835a59b4bfc202785478ff1a"},"deterministic":true,"exact_arithmetic":"fractions.Fraction","generator":{"name":"pareto-support-proofs","version":"0.6.1"},"oracle_adapter":"shortest_path_exact_dijkstra_v1","trace_digest":"sha256:25c254f26c1c87507db7bf3aa5c2d52bbc2d983927a838160eb891ade5af4a26"},"schema_version":"1.0.0","trust_level":"P1_FULLY_CHECKABLE"}
