{"candidate":{"decision":{"id":"a006"},"decision_digest":"sha256:1969b6553bd12b37f94c807c18eb4b5ad6d3750eae529b806368135c57325fec","outcome":["98","22","35"]},"canonicalisation":"psp-json-c14n-1","claim":"nonnegative_weight_unsupported","format":"pareto-support-certificate","instance_digest":"sha256:b27e932f8a14014835754a104158f8eca8c230e8b35cda301b377d4c2b074eb9","integrity":{"algorithm":"sha256","canonicalisation":"psp-json-c14n-1","certificate_digest":"sha256:21da99fad0af9a71281ccc6142cef9f12dcdafa5f4a4b7a8203d2c06d8039c8c"},"negative_payload":{"atoms":[{"coefficient":"4","decision":{"id":"a013"},"decision_digest":"sha256:e95dc62119205db55a2e8e5383efddf3b4d824efc493c01135c32d47f1934bf8","outcome":["41","78","6"]},{"coefficient":"85","decision":{"id":"a015"},"decision_digest":"sha256:e94325604a8422d8406be212e2560b1b716039d0ea67a8a2a49a54bddd806c97","outcome":["84","12","29"]}],"coefficient_sum":"89","coordinate_sums":["-1418","-626","-626"],"normalisation":"primitive-positive-integers-gcd-1","strict_margin":"626/89"},"problem_type":"explicit_image","provenance":{"algorithm":"exact-exchange-v1","context":{"case_id":"explicit_p3_s1003_hash_control","protocol_sha256":"356a26e2c79b1a6827d24e4236484ef1586c29dc835a59b4bfc202785478ff1a"},"deterministic":true,"exact_arithmetic":"fractions.Fraction","generator":{"name":"pareto-support-proofs","version":"0.6.1"},"oracle_adapter":"explicit_enumeration_exact_v1","trace_digest":"sha256:fc6ee09caa2b34eba2a086d847a5909301748db12a59334dd8cbf84b687eebc8"},"schema_version":"1.0.0","trust_level":"P1_FULLY_CHECKABLE"}
