{"candidate":{"decision":{"bits":"1111001010"},"decision_digest":"sha256:b8ebecee9a920b77f21e95d415f0a953a9517f5150a4e12464ac928f735f77d0","outcome":["-227","-186","-222","-214"]},"canonicalisation":"psp-json-c14n-1","claim":"nonnegative_weight_supportable","format":"pareto-support-certificate","instance_digest":"sha256:42065eda78784b10867274ac658c66708be0c5f9d92d5e8c2f31cbb2b1477e95","integrity":{"algorithm":"sha256","canonicalisation":"psp-json-c14n-1","certificate_digest":"sha256:eb887ebab6cd0c1e124fe2b3236345833989783d129b01871c2e8d81371f2141"},"positive_payload":{"candidate_scalar_value":"-32106/155","oracle":{"adapter":"binary_linear_exact_enumeration_reference_v1","proof":{"integer_weights":["0","64","91","0"],"minimiser_decision":{"bits":"1111001010"},"minimiser_outcome":["-227","-186","-222","-214"],"minimum_value":"-32106/155","oracle_statement":"global optimality is asserted by the generator and is outside the standalone checker's trusted-free verification boundary","weight_scale":"155"},"proof_type":"trusted_scalar_optimum_assertion_v1"},"scalar_minimum":"-32106/155","weight_floor":"0/1","weights":["0/1","64/155","91/155","0/1"]},"problem_type":"binary_linear","provenance":{"algorithm":"exact-exchange-v1","context":{"case_id":"knapsack_p4_s4002_epsilon_q42","protocol_sha256":"356a26e2c79b1a6827d24e4236484ef1586c29dc835a59b4bfc202785478ff1a"},"deterministic":true,"exact_arithmetic":"fractions.Fraction","generator":{"name":"pareto-support-proofs","version":"0.6.1"},"oracle_adapter":"binary_linear_exact_enumeration_reference_v1","trace_digest":"sha256:9127f9ea5e3c8da5037ecd619e12e3a891e6a1687a3471a36346cf3d01d7d1fd"},"schema_version":"1.0.0","trust_level":"P2_TRUSTED_ORACLE"}
