{"candidate":{"decision":{"bits":"0101110000"},"decision_digest":"sha256:f0859fecb3caa4e1ceef7cb05a77eaf987b7603e8e011494b8dacbaa3e68255a","outcome":["-162","-142","-80"]},"canonicalisation":"psp-json-c14n-1","claim":"nonnegative_weight_unsupported","format":"pareto-support-certificate","instance_digest":"sha256:78706351dbb0641b67311a94c32eab427699a35930087d9e6b2178d853fb40d6","integrity":{"algorithm":"sha256","canonicalisation":"psp-json-c14n-1","certificate_digest":"sha256:57a57d54b16267769dd457fc7851d1eabfd459ef9e99f102c24c424a4ce6fc65"},"negative_payload":{"atoms":[{"coefficient":"1","decision":{"bits":"1011000101"},"decision_digest":"sha256:aaae300fe4ccd54a3f6c5803d60cecbd05c87652f0e4fa24c3490623487ddbdf","outcome":["-240","-291","-204"]}],"coefficient_sum":"1","coordinate_sums":["-78","-149","-124"],"normalisation":"primitive-positive-integers-gcd-1","strict_margin":"78/1"},"problem_type":"binary_linear","provenance":{"algorithm":"exact-exchange-v1","context":{"case_id":"knapsack_p3_s4003_hash_control","protocol_sha256":"356a26e2c79b1a6827d24e4236484ef1586c29dc835a59b4bfc202785478ff1a"},"deterministic":true,"exact_arithmetic":"fractions.Fraction","generator":{"name":"pareto-support-proofs","version":"0.6.1"},"oracle_adapter":"binary_linear_exact_enumeration_reference_v1","trace_digest":"sha256:84fc9bb97d2fbb2cc5e3be0690d793395d8bf7af11ae1202c687c3e25ec44fc8"},"schema_version":"1.0.0","trust_level":"P1_FULLY_CHECKABLE"}
