{"candidate":{"decision":{"id":"a006"},"decision_digest":"sha256:1969b6553bd12b37f94c807c18eb4b5ad6d3750eae529b806368135c57325fec","outcome":["39","25","8","114"]},"canonicalisation":"psp-json-c14n-1","claim":"nonnegative_weight_unsupported","format":"pareto-support-certificate","instance_digest":"sha256:db4354c2eb867cdbd35199a5492aa494562489c5c60ba501b3d933c8105d8499","integrity":{"algorithm":"sha256","canonicalisation":"psp-json-c14n-1","certificate_digest":"sha256:fc3234dc7284ac6b430456a29edb52a0ef9bd9a6cbbfeffbe9895b22b42a53c1"},"negative_payload":{"atoms":[{"coefficient":"1","decision":{"id":"a002"},"decision_digest":"sha256:26320e30b550ff7b5c5ab92d79fe6779ee3b3a8d41499f13f240b83e9850032b","outcome":["15","7","2","25"]}],"coefficient_sum":"1","coordinate_sums":["-24","-18","-6","-89"],"normalisation":"primitive-positive-integers-gcd-1","strict_margin":"6/1"},"problem_type":"explicit_image","provenance":{"algorithm":"exact-exchange-v1","context":{"case_id":"explicit_p4_s1009_hash_control","protocol_sha256":"356a26e2c79b1a6827d24e4236484ef1586c29dc835a59b4bfc202785478ff1a"},"deterministic":true,"exact_arithmetic":"fractions.Fraction","generator":{"name":"pareto-support-proofs","version":"0.6.1"},"oracle_adapter":"explicit_enumeration_exact_v1","trace_digest":"sha256:c580fc31802f7a6a14b4534a4c66a8ecd85d30bc1e87c6d727444c625af0ba93"},"schema_version":"1.0.0","trust_level":"P1_FULLY_CHECKABLE"}
