{"candidate":{"decision":{"bits":"1010100001"},"decision_digest":"sha256:d37dcac0f25e5448168b7c3a3370ea00d240fa822804285b18e841b671f77b1b","outcome":["-66","-76","-197"]},"canonicalisation":"psp-json-c14n-1","claim":"nonnegative_weight_unsupported","format":"pareto-support-certificate","instance_digest":"sha256:795876974c0c414468a5e544f4d49479dd7037c9f24c4acb80b31816bc0e7595","integrity":{"algorithm":"sha256","canonicalisation":"psp-json-c14n-1","certificate_digest":"sha256:ae1a49a2b528872c0abe1b29fba9a8452e84bf2bfb24deea55a81947a33749a4"},"negative_payload":{"atoms":[{"coefficient":"1","decision":{"bits":"0110110110"},"decision_digest":"sha256:4bda0f88fe800eaad57d200170838c14ff14a9fcd3effd839192f84ea5e8b69c","outcome":["-143","-208","-266"]}],"coefficient_sum":"1","coordinate_sums":["-77","-132","-69"],"normalisation":"primitive-positive-integers-gcd-1","strict_margin":"69/1"},"problem_type":"binary_linear","provenance":{"algorithm":"exact-exchange-v1","context":{"case_id":"knapsack_p3_s4002_hash_control","protocol_sha256":"356a26e2c79b1a6827d24e4236484ef1586c29dc835a59b4bfc202785478ff1a"},"deterministic":true,"exact_arithmetic":"fractions.Fraction","generator":{"name":"pareto-support-proofs","version":"0.6.1"},"oracle_adapter":"binary_linear_exact_enumeration_reference_v1","trace_digest":"sha256:baac6aec6fd26f507a3e791e2fb161ca8c871b0b9a2393d6128af6c0887a4572"},"schema_version":"1.0.0","trust_level":"P1_FULLY_CHECKABLE"}
