{"candidate":{"decision":{"bits":"0111000100"},"decision_digest":"sha256:19067692fb587c86c31a46d27fa7445875c2d98711c3698c2eb27a39325f0508","outcome":["-166","-179","-76","-187"]},"canonicalisation":"psp-json-c14n-1","claim":"nonnegative_weight_unsupported","format":"pareto-support-certificate","instance_digest":"sha256:42065eda78784b10867274ac658c66708be0c5f9d92d5e8c2f31cbb2b1477e95","integrity":{"algorithm":"sha256","canonicalisation":"psp-json-c14n-1","certificate_digest":"sha256:e5b3f8a187ccb1e86ddba719a02749f6825112af382c3f92200c6e8c207151cb"},"negative_payload":{"atoms":[{"coefficient":"1","decision":{"bits":"0111001110"},"decision_digest":"sha256:faab0845355417214cdcae6717078feb89dcd6c4955aefead094e1ac1355956e","outcome":["-242","-204","-167","-245"]}],"coefficient_sum":"1","coordinate_sums":["-76","-25","-91","-58"],"normalisation":"primitive-positive-integers-gcd-1","strict_margin":"25/1"},"problem_type":"binary_linear","provenance":{"algorithm":"exact-exchange-v1","context":{"case_id":"knapsack_p4_s4002_hash_control","protocol_sha256":"356a26e2c79b1a6827d24e4236484ef1586c29dc835a59b4bfc202785478ff1a"},"deterministic":true,"exact_arithmetic":"fractions.Fraction","generator":{"name":"pareto-support-proofs","version":"0.6.1"},"oracle_adapter":"binary_linear_exact_enumeration_reference_v1","trace_digest":"sha256:415867fb3d361f87f07b6d545d7919bcd2f90fc06a66e13da53efaec538d9a59"},"schema_version":"1.0.0","trust_level":"P1_FULLY_CHECKABLE"}
