{"candidate":{"decision":{"bits":"0010011111"},"decision_digest":"sha256:89be3c0b5fcb91d162e143a81966469d5eef5b78b9e620155e91d1bb9ea3dd56","outcome":["-254","-230"]},"canonicalisation":"psp-json-c14n-1","claim":"nonnegative_weight_unsupported","format":"pareto-support-certificate","instance_digest":"sha256:bb80e3bf7ab863309825b04f869cb62ec3bc6bb99b8a98c770c126df37b355e2","integrity":{"algorithm":"sha256","canonicalisation":"psp-json-c14n-1","certificate_digest":"sha256:946a31330f2da374f480d6942e237fe7f2bb29a81106e6b235aa5efb74b45025"},"negative_payload":{"atoms":[{"coefficient":"1","decision":{"bits":"1010011011"},"decision_digest":"sha256:53a90946d948ef582f5eba05b66e407946e7befd8ffbe3ab59ffbd2a77f90e93","outcome":["-261","-260"]}],"coefficient_sum":"1","coordinate_sums":["-7","-30"],"normalisation":"primitive-positive-integers-gcd-1","strict_margin":"7/1"},"problem_type":"binary_linear","provenance":{"algorithm":"exact-exchange-v1","context":{"case_id":"knapsack_p2_s4001_hash_control","protocol_sha256":"356a26e2c79b1a6827d24e4236484ef1586c29dc835a59b4bfc202785478ff1a"},"deterministic":true,"exact_arithmetic":"fractions.Fraction","generator":{"name":"pareto-support-proofs","version":"0.6.1"},"oracle_adapter":"binary_linear_exact_enumeration_reference_v1","trace_digest":"sha256:4d0f2998136fda34bc10c8c13191ef4dcb366d5e5f604f3148e99d406d161742"},"schema_version":"1.0.0","trust_level":"P1_FULLY_CHECKABLE"}
