{"candidate":{"decision":{"permutation":[0,1,2,3]},"decision_digest":"sha256:547b28406741c057a9bd9818259b0fd3b1f3bb02951f77e9d954ffc90157bc78","outcome":["10","10","8"]},"canonicalisation":"psp-json-c14n-1","claim":"positive_weight_supportable","format":"pareto-support-certificate","instance_digest":"sha256:27122297a4556d5bf50281e8dcb950855b223bff6b99fca44f3c8c78e6f698bc","integrity":{"algorithm":"sha256","canonicalisation":"psp-json-c14n-1","certificate_digest":"sha256:e08b4648b697b09a8d75864a47cfd67f37cecb1995703e1550f0a923a47cac44"},"positive_payload":{"candidate_scalar_value":"28/3","oracle":{"adapter":"assignment_exact_hungarian_v1","proof":{"column_potentials":["0/1","0/1","0/1","0/1"],"constant_value":"0/1","matrix_value":"28/3","minimiser_decision":{"permutation":[0,1,2,3]},"minimiser_outcome":["10","10","8"],"minimum_value":"28/3","row_potentials":["7/3","7/3","7/3","7/3"]},"proof_type":"assignment_primal_dual_v1"},"scalar_minimum":"28/3","weight_floor":"1/3","weights":["1/3","1/3","1/3"]},"problem_type":"assignment","provenance":{"algorithm":"exact-exchange-v1","deterministic":true,"exact_arithmetic":"fractions.Fraction","generator":{"name":"pareto-support-proofs","version":"0.6.1"},"oracle_adapter":"assignment_exact_hungarian_v1","trace_digest":"sha256:ea2b7aacadf7b839a6826d3dcd817c00f14d9c768afcc43ea22100d258cddfd5"},"schema_version":"1.0.0","trust_level":"P1_FULLY_CHECKABLE"}
