{"candidate":{"decision":{"id":"a009"},"decision_digest":"sha256:3074c37e39712066e021ac0e0680a0e41963998af4ea45d734692453c6955800","outcome":["37","13","49"]},"canonicalisation":"psp-json-c14n-1","claim":"nonnegative_weight_unsupported","format":"pareto-support-certificate","instance_digest":"sha256:623e0a534b82038514d4fa9e48fb0aeb9c0c4e0915ee5e0ae2bb6711c31c4114","integrity":{"algorithm":"sha256","canonicalisation":"psp-json-c14n-1","certificate_digest":"sha256:bdc36c054cd91807fa3f7e2d16319ea5e9865eb6a46f6c43142e73411c07f164"},"negative_payload":{"atoms":[{"coefficient":"809","decision":{"id":"a018"},"decision_digest":"sha256:26826f0432776a6a483eb17ae9a1f432c16a7cf1873a74e2917592cbbbe83a55","outcome":["6","7","68"]},{"coefficient":"125","decision":{"id":"a021"},"decision_digest":"sha256:af5a9531236610036ba96f2a2462f094a9285028df729ff4e142713f81b3e85b","outcome":["41","100","3"]},{"coefficient":"900","decision":{"id":"a022"},"decision_digest":"sha256:4436c56d26e7e71dfde63588a2927af069d6c5c52e0677094b72852f53f06298","outcome":["58","0","32"]}],"coefficient_sum":"1834","coordinate_sums":["-5679","-5679","-5679"],"normalisation":"primitive-positive-integers-gcd-1","strict_margin":"5679/1834"},"problem_type":"explicit_image","provenance":{"algorithm":"exact-exchange-v1","context":{"case_id":"explicit_p3_s1005_epsilon_q42","protocol_sha256":"356a26e2c79b1a6827d24e4236484ef1586c29dc835a59b4bfc202785478ff1a"},"deterministic":true,"exact_arithmetic":"fractions.Fraction","generator":{"name":"pareto-support-proofs","version":"0.6.1"},"oracle_adapter":"explicit_enumeration_exact_v1","trace_digest":"sha256:3c7b0aaa39de7a01666e519cbe6ef799d70918acf3cce645bc51be5922909993"},"schema_version":"1.0.0","trust_level":"P1_FULLY_CHECKABLE"}
