{"candidate":{"decision":{"id":"a008"},"decision_digest":"sha256:78ea0b2c0be1c2a2840389579a0bff9206b3cc1ff8220052175ce4ce6b174f31","outcome":["6","10","22"]},"canonicalisation":"psp-json-c14n-1","claim":"positive_weight_supportable","format":"pareto-support-certificate","instance_digest":"sha256:132a251dce0383a659fdc1f44af0d0de311fbc6b3bbac82917402b3564cb7c00","integrity":{"algorithm":"sha256","canonicalisation":"psp-json-c14n-1","certificate_digest":"sha256:18e08e6a67a5c831a904bda6c74530eb858dcbf7c5d2c82ad63d154ae6b83541"},"positive_payload":{"candidate_scalar_value":"38/3","oracle":{"adapter":"explicit_enumeration_exact_v1","proof":{"minimiser_decision":{"id":"a008"},"minimiser_outcome":["6","10","22"],"minimum_value":"38/3","tie_break":"canonical-decision-order"},"proof_type":"explicit_enumeration_v1"},"scalar_minimum":"38/3","weight_floor":"1/3","weights":["1/3","1/3","1/3"]},"problem_type":"explicit_image","provenance":{"algorithm":"exact-exchange-v1","context":{"case_id":"explicit_p3_s1009_epsilon_q42","protocol_sha256":"356a26e2c79b1a6827d24e4236484ef1586c29dc835a59b4bfc202785478ff1a"},"deterministic":true,"exact_arithmetic":"fractions.Fraction","generator":{"name":"pareto-support-proofs","version":"0.6.1"},"oracle_adapter":"explicit_enumeration_exact_v1","trace_digest":"sha256:2b419600ef298ba6544d39c60cb3ef0a1fb3dc6d7ca98a332d57219d0d9b4685"},"schema_version":"1.0.0","trust_level":"P1_FULLY_CHECKABLE"}
