{"candidate":{"decision":{"edge_ids":["e0010","e0007"]},"decision_digest":"sha256:a3cbebfb6e38a743c148312ba8dc3564204b13f37a506b4e2fb67c57dfde1b53","outcome":["53","41","25","27"]},"canonicalisation":"psp-json-c14n-1","claim":"positive_weight_supportable","format":"pareto-support-certificate","instance_digest":"sha256:4fadb6884c39d2be663a043f76eddd64d20777d8a84639286eed3fc074bb7dd0","integrity":{"algorithm":"sha256","canonicalisation":"psp-json-c14n-1","certificate_digest":"sha256:fae67035b1ace0d95f116ed2fe2cdc16c94345f879bcd0f00f021e3f2bcb521b"},"positive_payload":{"candidate_scalar_value":"73/2","oracle":{"adapter":"shortest_path_exact_dijkstra_v1","proof":{"constant_value":"0/1","minimiser_decision":{"edge_ids":["e0010","e0007"]},"minimiser_outcome":["53","41","25","27"],"minimum_value":"73/2","node_potentials":{"v0":"0/1","v1":"57/4","v2":"14/1","v3":"36/1","v4":"99/2","v5":"29/2","v6":"71/4","v7":"73/2"},"path_value":"73/2"},"proof_type":"shortest_path_potentials_v1"},"scalar_minimum":"73/2","weight_floor":"1/4","weights":["1/4","1/4","1/4","1/4"]},"problem_type":"shortest_path","provenance":{"algorithm":"exact-exchange-v1","context":{"case_id":"shortest_path_p4_s3003_epsilon_q42","protocol_sha256":"356a26e2c79b1a6827d24e4236484ef1586c29dc835a59b4bfc202785478ff1a"},"deterministic":true,"exact_arithmetic":"fractions.Fraction","generator":{"name":"pareto-support-proofs","version":"0.6.1"},"oracle_adapter":"shortest_path_exact_dijkstra_v1","trace_digest":"sha256:094f46fa71c6f452623b9208ccf442ba6b3dc359501c41dbdab1a7ab20a9d835"},"schema_version":"1.0.0","trust_level":"P1_FULLY_CHECKABLE"}
